{
  "approval_hash": "b39e8d5399cdf5099509b68f3ed7aa9b3163555b70323ca4951f5cdee182779a",
  "approval_id": "d600a3fee61577fed7186eddb88a05d140bdd8fabe4f151cbe818dc05fbe3aa7",
  "approver": "Damien",
  "comment": "",
  "created_utc": "2026-03-04T00:12:21Z",
  "decision": "APPROVE",
  "plan_hash": "b4134c998102f71c13ac7d9d49b062b26c0d36ead6660cd8456762fc25c97be1",
  "schema_version": "1"
}